{
  "$schema": "https://json-schema.org/draft/2020-12/schema",
  "$id": "https://github.com/mavai-org/mavai-R/schema/cases.schema.json",
  "title": "mavai-R conformance case suite",
  "description": "Schema for statistical conformance reference datasets produced by mavai-R, fixture schema version 2. Each JSON file represents one suite of test cases. Top-level shape is uniform across suites; the inputs/expected payloads vary per suite. See R/*.R generators for the per-suite payload shape. Version 2 (methodology 1.5.0) adds methodologyVersion, fixtureSchemaVersion and decisionRules at suite level and an optional decisionRule per case.",
  "type": "object",
  "required": [
    "suite",
    "methodologyVersion",
    "fixtureSchemaVersion",
    "decisionRules",
    "description",
    "method",
    "tolerance",
    "cases"
  ],
  "additionalProperties": false,
  "properties": {
    "suite": {
      "type": "string",
      "description": "Machine-readable suite identifier (e.g. 'wilson_ci', 'verdict', 'criterion_verdict_inferential')."
    },
    "methodologyVersion": {
      "type": "string",
      "pattern": "^[0-9]+\\.[0-9]+\\.[0-9]+$",
      "description": "The Statistical Companion methodology version the suite's expected values implement (e.g. '1.5.0')."
    },
    "fixtureSchemaVersion": {
      "const": 2,
      "description": "Version of the fixture file shape this schema describes. 1 was the unversioned shape up to fixtures 0.10.13; 2 adds methodologyVersion, fixtureSchemaVersion and decisionRules."
    },
    "decisionRules": {
      "type": "array",
      "description": "The versioned decision rules the suite's expected values depend on; empty for descriptive and structural suites.",
      "items": {
        "$ref": "#/$defs/decisionRuleVersion"
      }
    },
    "description": {
      "type": "string",
      "description": "Human-readable description of what this suite tests."
    },
    "method": {
      "type": "string",
      "description": "Statistical method used to produce expected values."
    },
    "tolerance": {
      "type": "number",
      "minimum": 0,
      "description": "Absolute tolerance for floating-point comparison of expected values. A tolerance of 0 means exact match is required."
    },
    "cases": {
      "type": "array",
      "minItems": 1,
      "description": "The individual test cases in this suite.",
      "items": {
        "$ref": "#/$defs/case"
      }
    }
  },
  "$defs": {
    "case": {
      "type": "object",
      "required": [
        "name",
        "inputs",
        "expected"
      ],
      "additionalProperties": false,
      "properties": {
        "name": {
          "type": "string",
          "description": "Unique, descriptive case identifier within this suite."
        },
        "description": {
          "type": "string",
          "description": "Optional per-case description, used in suites where individual cases warrant prose explanation."
        },
        "approach": {
          "type": "string",
          "description": "Sub-approach within the suite (e.g. 'sample_size_first', 'threshold_first'). Present only in suites with multiple derivation strategies."
        },
        "procedure": {
          "type": "string",
          "enum": [
            "REGRESSION",
            "COMPLIANCE"
          ],
          "description": "Procedure direction per companion §3.2 / §1.4.6 (SC-RU-05): the kind of threshold, not a versioned rule (see decisionRule). Present on inferential per-criterion cases."
        },
        "decisionRule": {
          "description": "The decision rule(s) a case exercises, where its suite lists more than one. A configuration carrying both a normative and an empirical bar names both.",
          "oneOf": [
            {
              "$ref": "#/$defs/decisionRuleId"
            },
            {
              "type": "array",
              "minItems": 1,
              "uniqueItems": true,
              "items": {
                "$ref": "#/$defs/decisionRuleId"
              }
            }
          ]
        },
        "inputs": {
          "description": "Input parameters for the statistical computation. Shape varies by suite. Computation suites use a flat numeric-keyed object; per-criterion verdict suites add procedure/denominator_policy strings; baseline-object and scenario suites carry nested baseline / test_run objects.",
          "$ref": "#/$defs/anyJson"
        },
        "expected": {
          "description": "Expected outputs from R's reference computation. Shape varies by suite. Numeric values are compared within the suite's tolerance; boolean / string values are compared exactly; nested objects are compared structurally.",
          "$ref": "#/$defs/anyJson"
        }
      }
    },
    "decisionRuleId": {
      "type": "string",
      "enum": [
        "regression/fisher",
        "compliance/exact-binomial",
        "latency/precedence",
        "latency/compliance-exact-binomial",
        "compliance/smoke-exact-binomial",
        "latency/smoke-compliance-exact-binomial"
      ],
      "description": "A versioned decision rule: the four of methodology 1.5.0, and the two SMOKE rules of methodology 1.7.0 (1.7.1 states that their criteria enter neither Type-I envelope)."
    },
    "decisionRuleVersion": {
      "type": "object",
      "required": [
        "id",
        "version"
      ],
      "additionalProperties": false,
      "properties": {
        "id": {
          "$ref": "#/$defs/decisionRuleId"
        },
        "version": {
          "type": "integer",
          "minimum": 1
        }
      }
    },
    "anyJson": {
      "description": "Any JSON value: number, boolean, string, null, array, or object. Used where the schema cannot tightly constrain the shape because it varies per suite.",
      "oneOf": [
        {
          "type": "number"
        },
        {
          "type": "boolean"
        },
        {
          "type": "string"
        },
        {
          "type": "null"
        },
        {
          "type": "array",
          "items": {
            "$ref": "#/$defs/anyJson"
          }
        },
        {
          "type": "object",
          "additionalProperties": {
            "$ref": "#/$defs/anyJson"
          }
        }
      ]
    },
    "denominatorPolicy": {
      "type": "string",
      "enum": [
        "CONDITIONAL_ON_EVALUABLE",
        "MARGINAL_COUNT_UNEVALUABLE_AS_FAIL"
      ],
      "description": "Per companion §1.4.5a, the methodology defines exactly two denominator policies. Cited from R generators that need to validate this enum explicitly."
    },
    "criterionMode": {
      "type": "string",
      "enum": [
        "inferential",
        "observational"
      ],
      "description": "Per companion §1.4.5."
    }
  }
}
